{
 "format": "minest.world/1",
 "id": "philosophy-kant",
 "version": 1,
 "versionString": "1.0.0",
 "family": "advanced-philosophy",
 "name": "My Critical World",
 "philosopher": "Immanuel Kant",
 "color": "#4c5fd5",
 "tagline": "What I know, what I value, what I hope for.",
 "description": "Sort my world by what I experience and know, what I still need to check, what I hold myself to, and what I hope for.",
 "inspiration": "Original: Kant’s three Critiques ask how knowledge is possible and where its limits lie (Pure Reason), how reason can guide action through duty (Practical Reason), and how we judge beauty and purpose in nature (Judgment). He summed up philosophy in four questions: What can I know? What ought I to do? What may I hope? What is a human being?\n\nMinest adaptation: the areas of this template follow those questions in everyday words. It is a modern, Kant-inspired way to sort a personal world; it does not carry out his transcendental philosophy. The twelve categories are kept as an advanced lens, not as twelve folders.",
 "philosophy": {
  "primaryWorks": [
   "Critique of Pure Reason (1781/1787)",
   "Critique of Practical Reason (1788)",
   "Critique of Judgment (1790)"
  ],
  "coreConcepts": [
   "experience and concepts",
   "knowledge and its limits",
   "practical reason and duty",
   "moral judgment",
   "aesthetic and reflective judgment",
   "the human questions"
  ],
  "original": "Original: Kant’s three Critiques ask how knowledge is possible and where its limits lie (Pure Reason), how reason can guide action through duty (Practical Reason), and how we judge beauty and purpose in nature (Judgment). He summed up philosophy in four questions: What can I know? What ought I to do? What may I hope? What is a human being?",
  "adaptation": "Minest adaptation: the areas of this template follow those questions in everyday words. It is a modern, Kant-inspired way to sort a personal world; it does not carry out his transcendental philosophy. The twelve categories are kept as an advanced lens, not as twelve folders."
 },
 "thinkingQuestions": [
  {
   "id": "q1",
   "text": "What can I know about this — and how?"
  },
  {
   "id": "q2",
   "text": "What ought I to do here?"
  },
  {
   "id": "q3",
   "text": "What may I hope for?"
  },
  {
   "id": "q4",
   "text": "What does this say about being human?"
  }
 ],
 "discoveryTool": {
  "id": "what-can-i-know",
  "name": "What Can I Really Know?",
  "summary": "Take one claim or piece of information and sort it: what I observed, what I learned, what I concluded, what I still don’t know.",
  "status": "planned"
 },
 "views": [
  "list",
  "contents",
  "portal"
 ],
 "recommendedViews": [
  "list",
  "contents",
  "portal"
 ],
 "depths": [
  "simple",
  "standard",
  "complete"
 ],
 "defaultDepth": "standard",
 "levels": {
  "domain": "list",
  "category": "section",
  "list": "card",
  "sublist": "card (Complete)",
  "item": "stack"
 },
 "domains": [
  {
   "id": "experience",
   "title": "My Experience",
   "color": "#3fa0c8",
   "categories": [
    {
     "id": "experience-my-senses",
     "title": "My Senses",
     "lists": [
      {
       "id": "my-sights-and-sounds",
       "title": "My Sights & Sounds"
      },
      {
       "id": "my-tastes-and-textures",
       "title": "My Tastes & Textures"
      }
     ]
    },
    {
     "id": "experience-my-observations",
     "title": "My Observations",
     "lists": [
      {
       "id": "my-field-notes",
       "title": "My Field Notes"
      }
     ]
    },
    {
     "id": "experience-my-perceptions",
     "title": "My Perceptions",
     "lists": [
      {
       "id": "my-first-impressions",
       "title": "My First Impressions"
      }
     ]
    }
   ]
  },
  {
   "id": "knowledge",
   "title": "My Knowledge",
   "color": "#4c5fd5",
   "categories": [
    {
     "id": "knowledge-my-concepts",
     "title": "My Concepts",
     "lists": [
      {
       "id": "my-key-ideas",
       "title": "My Key Ideas"
      }
     ]
    },
    {
     "id": "knowledge-my-evidence",
     "title": "My Evidence",
     "lists": [
      {
       "id": "my-sources",
       "title": "My Sources",
       "lists": [
        {
         "id": "my-books-and-articles",
         "title": "My Books & Articles"
        },
        {
         "id": "my-experts",
         "title": "My Experts"
        }
       ]
      },
      {
       "id": "my-facts-checked",
       "title": "My Facts Checked"
      }
     ]
    },
    {
     "id": "knowledge-my-understanding",
     "title": "My Understanding",
     "lists": [
      {
       "id": "my-explanations",
       "title": "My Explanations"
      }
     ]
    }
   ]
  },
  {
   "id": "questions",
   "title": "My Questions",
   "color": "#7a6fd0",
   "categories": [
    {
     "id": "questions-what-i-know",
     "title": "What I Know",
     "lists": [
      {
       "id": "things-im-sure-of",
       "title": "Things I’m Sure Of"
      }
     ]
    },
    {
     "id": "questions-what-i-dont-know-yet",
     "title": "What I Don’t Know Yet",
     "lists": [
      {
       "id": "my-open-questions",
       "title": "My Open Questions"
      }
     ]
    },
    {
     "id": "questions-what-i-need-to-examine",
     "title": "What I Need to Examine",
     "lists": [
      {
       "id": "claims-to-check",
       "title": "Claims to Check"
      }
     ]
    }
   ]
  },
  {
   "id": "principles",
   "title": "My Principles",
   "color": "#3a9e78",
   "categories": [
    {
     "id": "principles-my-duties",
     "title": "My Duties",
     "lists": [
      {
       "id": "my-promises",
       "title": "My Promises"
      }
     ]
    },
    {
     "id": "principles-my-moral-decisions",
     "title": "My Moral Decisions",
     "lists": [
      {
       "id": "my-hard-choices",
       "title": "My Hard Choices"
      }
     ]
    },
    {
     "id": "principles-my-responsibilities",
     "title": "My Responsibilities",
     "lists": [
      {
       "id": "my-roles",
       "title": "My Roles"
      }
     ]
    }
   ]
  },
  {
   "id": "judgments",
   "title": "My Judgments",
   "color": "#d0628a",
   "categories": [
    {
     "id": "judgments-my-sense-of-beauty",
     "title": "My Sense of Beauty",
     "lists": [
      {
       "id": "things-i-find-beautiful",
       "title": "Things I Find Beautiful"
      }
     ]
    },
    {
     "id": "judgments-my-reflections-on-nature",
     "title": "My Reflections on Nature",
     "lists": [
      {
       "id": "my-wonders-of-nature",
       "title": "My Wonders of Nature"
      }
     ]
    },
    {
     "id": "judgments-my-evaluations",
     "title": "My Evaluations",
     "lists": [
      {
       "id": "my-reviews",
       "title": "My Reviews"
      }
     ]
    }
   ]
  },
  {
   "id": "hopes",
   "title": "My Hopes",
   "color": "#d39b2f",
   "categories": [
    {
     "id": "hopes-my-aspirations",
     "title": "My Aspirations",
     "lists": [
      {
       "id": "my-goals",
       "title": "My Goals"
      }
     ]
    },
    {
     "id": "hopes-my-beliefs",
     "title": "My Beliefs",
     "lists": [
      {
       "id": "my-convictions",
       "title": "My Convictions"
      }
     ]
    },
    {
     "id": "hopes-my-future",
     "title": "My Future",
     "lists": [
      {
       "id": "my-plans",
       "title": "My Plans"
      }
     ]
    }
   ]
  },
  {
   "id": "human",
   "title": "My Human World",
   "color": "#d77a2f",
   "categories": [
    {
     "id": "human-my-relationships",
     "title": "My Relationships",
     "lists": [
      {
       "id": "my-people",
       "title": "My People"
      }
     ]
    },
    {
     "id": "human-my-society",
     "title": "My Society",
     "lists": [
      {
       "id": "my-communities",
       "title": "My Communities"
      }
     ]
    },
    {
     "id": "human-my-humanity",
     "title": "My Humanity",
     "lists": [
      {
       "id": "my-shared-values",
       "title": "My Shared Values"
      }
     ]
    }
   ]
  }
 ],
 "lenses": [
  {
   "title": "Kant’s twelve categories",
   "note": "From the Critique of Pure Reason: the basic concepts of understanding. An advanced lens, not a set of folders.",
   "groups": [
    {
     "title": "Quantity",
     "items": [
      "Unity",
      "Plurality",
      "Totality"
     ]
    },
    {
     "title": "Quality",
     "items": [
      "Reality",
      "Negation",
      "Limitation"
     ]
    },
    {
     "title": "Relation",
     "items": [
      "Substance",
      "Cause and effect",
      "Community"
     ]
    },
    {
     "title": "Modality",
     "items": [
      "Possibility",
      "Existence",
      "Necessity"
     ]
    }
   ]
  }
 ]
}