{
 "format": "minest.world/1",
 "id": "encyclopedie",
 "name": "Encyclopédie Tree",
 "version": 1,
 "family": "classical",
 "color": "#8d6e63",
 "description": "Memory, reason and imagination — the Enlightenment’s tree of knowledge.",
 "inspiration": "Inspired by the “figurative system of human knowledge” in Diderot and d’Alembert’s Encyclopédie (1751–1772): Memory gives History, Reason gives Philosophy and the sciences, Imagination gives Poetry and the arts.",
 "levels": {
  "domain": "list",
  "category": "section",
  "list": "card",
  "item": "stack"
 },
 "views": [
  "contents",
  "portal",
  "kanban",
  "map"
 ],
 "domains": [
  {
   "id": "memory",
   "title": "My Memories",
   "color": "#6d4c41",
   "categories": [
    {
     "id": "memory-beliefs-and-traditions",
     "title": "Beliefs & Traditions",
     "lists": [
      {
       "id": "my-traditions",
       "title": "My Traditions"
      }
     ]
    },
    {
     "id": "memory-human-history",
     "title": "Human History",
     "lists": [
      {
       "id": "my-family-history",
       "title": "My Family History"
      },
      {
       "id": "my-town-s-history",
       "title": "My Town’s History"
      },
      {
       "id": "my-world-events",
       "title": "My World Events"
      }
     ]
    },
    {
     "id": "memory-natural-history",
     "title": "Natural History",
     "lists": [
      {
       "id": "my-nature-wonders",
       "title": "My Nature Wonders"
      },
      {
       "id": "my-uses-of-nature",
       "title": "My Uses of Nature"
      }
     ]
    }
   ],
   "note": "Memory → History"
  },
  {
   "id": "reason",
   "title": "My Knowledge & Thinking",
   "color": "#1565c0",
   "categories": [
    {
     "id": "reason-big-questions",
     "title": "Big Questions",
     "lists": [
      {
       "id": "my-beliefs-and-big-questions",
       "title": "My Beliefs & Big Questions"
      }
     ]
    },
    {
     "id": "reason-science-of-people",
     "title": "Science of People",
     "lists": [
      {
       "id": "my-logic",
       "title": "My Logic"
      },
      {
       "id": "my-ethics",
       "title": "My Ethics"
      },
      {
       "id": "my-language",
       "title": "My Language"
      }
     ]
    },
    {
     "id": "reason-science-of-nature",
     "title": "Science of Nature",
     "lists": [
      {
       "id": "my-mathematics",
       "title": "My Mathematics"
      },
      {
       "id": "my-physics",
       "title": "My Physics"
      },
      {
       "id": "my-chemistry",
       "title": "My Chemistry"
      },
      {
       "id": "my-living-things",
       "title": "My Living Things"
      }
     ]
    }
   ],
   "note": "Reason → Philosophy"
  },
  {
   "id": "imagination",
   "title": "My Ideas & Creations",
   "color": "#c2185b",
   "categories": [
    {
     "id": "imagination-poetry",
     "title": "Poetry",
     "lists": [
      {
       "id": "my-stories",
       "title": "My Stories"
      },
      {
       "id": "my-plays-and-films",
       "title": "My Plays & Films"
      },
      {
       "id": "my-fables",
       "title": "My Fables"
      }
     ]
    },
    {
     "id": "imagination-fine-arts",
     "title": "Fine Arts",
     "lists": [
      {
       "id": "my-music",
       "title": "My Music"
      },
      {
       "id": "my-painting",
       "title": "My Painting"
      },
      {
       "id": "my-sculpture-and-architecture",
       "title": "My Sculpture & Architecture"
      }
     ]
    }
   ],
   "note": "Imagination → Poetry & Arts"
  }
 ]
}