{
 "format": "minest.world/1",
 "id": "whole-earth",
 "name": "My Whole Earth",
 "version": 1,
 "family": "everyday",
 "color": "#7cb342",
 "description": "Tools, places, skills and adventures — a hands-on catalog of your life.",
 "inspiration": "Inspired by the Whole Earth Catalog (1968–1972), whose motto was “access to tools”: practical things, ideas and resources for living, making and exploring. This is a modern personal adaptation, not a copy of the catalog.",
 "levels": {
  "domain": "list",
  "category": "section",
  "list": "card",
  "item": "stack"
 },
 "views": [
  "contents",
  "portal",
  "kanban",
  "map"
 ],
 "domains": [
  {
   "id": "big-picture",
   "title": "My Big Picture",
   "color": "#5c6bc0",
   "categories": [
    {
     "id": "big-picture-whole-systems",
     "title": "Whole Systems",
     "lists": [
      {
       "id": "my-big-ideas",
       "title": "My Big Ideas"
      },
      {
       "id": "my-favorite-thinkers",
       "title": "My Favorite Thinkers"
      },
      {
       "id": "my-maps-of-the-world",
       "title": "My Maps of the World"
      }
     ]
    },
    {
     "id": "big-picture-ways-of-seeing",
     "title": "Ways of Seeing",
     "lists": [
      {
       "id": "my-questions",
       "title": "My Questions"
      },
      {
       "id": "my-patterns",
       "title": "My Patterns"
      }
     ]
    }
   ]
  },
  {
   "id": "land",
   "title": "My Land & Nature",
   "color": "#43a047",
   "categories": [
    {
     "id": "land-growing",
     "title": "Growing",
     "lists": [
      {
       "id": "my-garden",
       "title": "My Garden"
      },
      {
       "id": "my-plants",
       "title": "My Plants"
      },
      {
       "id": "my-trees",
       "title": "My Trees"
      }
     ]
    },
    {
     "id": "land-wild-things",
     "title": "Wild Things",
     "lists": [
      {
       "id": "my-animals-spotted",
       "title": "My Animals Spotted"
      },
      {
       "id": "my-weather-log",
       "title": "My Weather Log"
      },
      {
       "id": "my-night-sky",
       "title": "My Night Sky"
      }
     ]
    }
   ]
  },
  {
   "id": "home",
   "title": "My Home",
   "color": "#fb8c00",
   "categories": [
    {
     "id": "home-shelter",
     "title": "Shelter",
     "lists": [
      {
       "id": "my-rooms",
       "title": "My Rooms"
      },
      {
       "id": "my-furniture",
       "title": "My Furniture"
      },
      {
       "id": "my-home-projects",
       "title": "My Home Projects"
      },
      {
       "id": "my-dream-home",
       "title": "My Dream Home"
      }
     ]
    },
    {
     "id": "home-kitchen",
     "title": "Kitchen",
     "lists": [
      {
       "id": "my-recipes",
       "title": "My Recipes"
      },
      {
       "id": "my-kitchen-tools",
       "title": "My Kitchen Tools"
      }
     ]
    }
   ]
  },
  {
   "id": "tech",
   "title": "My Technology",
   "color": "#1e88e5",
   "categories": [
    {
     "id": "tech-tools",
     "title": "Tools",
     "lists": [
      {
       "id": "my-devices",
       "title": "My Devices"
      },
      {
       "id": "my-digital-tools",
       "title": "My Digital Tools"
      },
      {
       "id": "my-machines",
       "title": "My Machines"
      },
      {
       "id": "my-inventions",
       "title": "My Inventions"
      }
     ]
    },
    {
     "id": "tech-energy",
     "title": "Energy",
     "lists": [
      {
       "id": "my-energy-ideas",
       "title": "My Energy Ideas"
      }
     ]
    }
   ]
  },
  {
   "id": "creations",
   "title": "My Creations",
   "color": "#d81b60",
   "categories": [
    {
     "id": "creations-crafts",
     "title": "Crafts",
     "lists": [
      {
       "id": "my-craft-projects",
       "title": "My Craft Projects"
      },
      {
       "id": "my-materials",
       "title": "My Materials"
      }
     ]
    },
    {
     "id": "creations-making",
     "title": "Making",
     "lists": [
      {
       "id": "my-art",
       "title": "My Art"
      },
      {
       "id": "my-music-making",
       "title": "My Music Making"
      },
      {
       "id": "my-writing",
       "title": "My Writing"
      }
     ]
    }
   ]
  },
  {
   "id": "community",
   "title": "My Community",
   "color": "#8e24aa",
   "categories": [
    {
     "id": "community-people",
     "title": "People",
     "lists": [
      {
       "id": "my-neighbors",
       "title": "My Neighbors"
      },
      {
       "id": "my-groups",
       "title": "My Groups"
      },
      {
       "id": "my-mentors",
       "title": "My Mentors"
      }
     ]
    },
    {
     "id": "community-doing-good",
     "title": "Doing Good",
     "lists": [
      {
       "id": "my-volunteering",
       "title": "My Volunteering"
      },
      {
       "id": "my-local-places",
       "title": "My Local Places"
      }
     ]
    }
   ]
  },
  {
   "id": "adventures",
   "title": "My Adventures",
   "color": "#00897b",
   "categories": [
    {
     "id": "adventures-travel",
     "title": "Travel",
     "lists": [
      {
       "id": "my-trips",
       "title": "My Trips"
      },
      {
       "id": "my-places",
       "title": "My Places"
      },
      {
       "id": "my-travel-plans",
       "title": "My Travel Plans"
      }
     ]
    },
    {
     "id": "adventures-outdoors",
     "title": "Outdoors",
     "lists": [
      {
       "id": "my-outdoor-gear",
       "title": "My Outdoor Gear"
      },
      {
       "id": "my-hikes",
       "title": "My Hikes"
      },
      {
       "id": "my-camping",
       "title": "My Camping"
      }
     ]
    }
   ]
  },
  {
   "id": "connections",
   "title": "My Connections",
   "color": "#3949ab",
   "categories": [
    {
     "id": "connections-staying-in-touch",
     "title": "Staying in Touch",
     "lists": [
      {
       "id": "my-letters",
       "title": "My Letters"
      },
      {
       "id": "my-online-communities",
       "title": "My Online Communities"
      }
     ]
    },
    {
     "id": "connections-listening-and-reading",
     "title": "Listening & Reading",
     "lists": [
      {
       "id": "my-podcasts",
       "title": "My Podcasts"
      },
      {
       "id": "my-newsletters",
       "title": "My Newsletters"
      }
     ]
    }
   ]
  },
  {
   "id": "learning",
   "title": "My Learning",
   "color": "#f4511e",
   "categories": [
    {
     "id": "learning-teaching-myself",
     "title": "Teaching Myself",
     "lists": [
      {
       "id": "my-books",
       "title": "My Books"
      },
      {
       "id": "my-courses",
       "title": "My Courses"
      },
      {
       "id": "my-skills-to-learn",
       "title": "My Skills to Learn"
      }
     ]
    },
    {
     "id": "learning-resources",
     "title": "Resources",
     "lists": [
      {
       "id": "my-learning-resources",
       "title": "My Learning Resources"
      },
      {
       "id": "my-libraries",
       "title": "My Libraries"
      }
     ]
    }
   ]
  }
 ],
 "tagline": "Everything I use, make and explore."
}