{
 "format": "minest.world/1",
 "id": "philosophy-heidegger",
 "version": 1,
 "versionString": "1.0.0",
 "family": "advanced-philosophy",
 "name": "My Being-in-the-World",
 "philosopher": "Martin Heidegger",
 "color": "#5d6a8a",
 "tagline": "My everyday life, my cares, my possibilities.",
 "description": "Sort my world by where and with whom I live, what I care about, my past, my present and the paths open to me.",
 "inspiration": "Original: In Being and Time, Heidegger describes human existence as being-in-the-world: we always find ourselves among places, tools and other people, already caring about things. Our existence is temporal — shaped by what has been and stretched toward possibilities — and can be lived “authentically”, owning our choices rather than simply doing what “one” does.\n\nMinest adaptation: this template turns those ideas into everyday areas: my everyday world, my relationships, my concerns, my past, my present, my possibilities and choices that are my own. It is not a template about death, and it never asks you to think about it.",
 "philosophy": {
  "primaryWorks": [
   "Being and Time (1927)"
  ],
  "coreConcepts": [
   "being-in-the-world",
   "everydayness",
   "care",
   "being-with others",
   "temporality",
   "possibility",
   "authenticity"
  ],
  "original": "Original: In Being and Time, Heidegger describes human existence as being-in-the-world: we always find ourselves among places, tools and other people, already caring about things. Our existence is temporal — shaped by what has been and stretched toward possibilities — and can be lived “authentically”, owning our choices rather than simply doing what “one” does.",
  "adaptation": "Minest adaptation: this template turns those ideas into everyday areas: my everyday world, my relationships, my concerns, my past, my present, my possibilities and choices that are my own. It is not a template about death, and it never asks you to think about it."
 },
 "thinkingQuestions": [
  {
   "id": "q1",
   "text": "What has shaped me?"
  },
  {
   "id": "q2",
   "text": "Where am I now?"
  },
  {
   "id": "q3",
   "text": "What do I really care about?"
  },
  {
   "id": "q4",
   "text": "What could I pursue?"
  }
 ],
 "discoveryTool": {
  "id": "my-life-possibilities",
  "name": "My Life Possibilities",
  "summary": "Four doors — my past, my present, my concerns, my possibilities — to link lists, experiences, people and goals you already have.",
  "status": "planned"
 },
 "views": [
  "list",
  "timeline",
  "contents"
 ],
 "recommendedViews": [
  "list",
  "timeline",
  "contents"
 ],
 "depths": [
  "simple",
  "standard",
  "complete"
 ],
 "defaultDepth": "standard",
 "levels": {
  "domain": "list",
  "category": "section",
  "list": "card",
  "sublist": "card (Complete)",
  "item": "stack"
 },
 "domains": [
  {
   "id": "everyday",
   "title": "My Everyday World",
   "color": "#3fa0c8",
   "categories": [
    {
     "id": "everyday-my-places",
     "title": "My Places",
     "lists": [
      {
       "id": "my-home-places",
       "title": "My Home Places"
      },
      {
       "id": "my-favorite-spots",
       "title": "My Favorite Spots"
      }
     ]
    },
    {
     "id": "everyday-my-tools",
     "title": "My Tools",
     "lists": [
      {
       "id": "tools-i-rely-on",
       "title": "Tools I Rely On"
      }
     ]
    },
    {
     "id": "everyday-my-activities",
     "title": "My Activities",
     "lists": [
      {
       "id": "my-routines",
       "title": "My Routines"
      },
      {
       "id": "my-hobbies",
       "title": "My Hobbies"
      }
     ]
    }
   ]
  },
  {
   "id": "relationships",
   "title": "My Relationships",
   "color": "#d0628a",
   "categories": [
    {
     "id": "relationships-my-family",
     "title": "My Family",
     "lists": [
      {
       "id": "my-household",
       "title": "My Household"
      }
     ]
    },
    {
     "id": "relationships-my-friends",
     "title": "My Friends",
     "lists": [
      {
       "id": "my-close-friends",
       "title": "My Close Friends"
      }
     ]
    },
    {
     "id": "relationships-my-shared-life",
     "title": "My Shared Life",
     "lists": [
      {
       "id": "things-we-do-together",
       "title": "Things We Do Together"
      }
     ]
    }
   ]
  },
  {
   "id": "concerns",
   "title": "My Concerns",
   "color": "#d39b2f",
   "categories": [
    {
     "id": "concerns-what-i-care-about",
     "title": "What I Care About",
     "lists": [
      {
       "id": "my-cares",
       "title": "My Cares"
      }
     ]
    },
    {
     "id": "concerns-my-commitments",
     "title": "My Commitments",
     "lists": [
      {
       "id": "my-promises",
       "title": "My Promises"
      }
     ]
    },
    {
     "id": "concerns-my-responsibilities",
     "title": "My Responsibilities",
     "lists": [
      {
       "id": "my-roles",
       "title": "My Roles"
      }
     ]
    }
   ]
  },
  {
   "id": "past",
   "title": "My Past",
   "color": "#8a6d4b",
   "categories": [
    {
     "id": "past-my-experiences",
     "title": "My Experiences",
     "lists": [
      {
       "id": "my-formative-moments",
       "title": "My Formative Moments",
       "lists": [
        {
         "id": "my-childhood",
         "title": "My Childhood"
        },
        {
         "id": "my-school-years",
         "title": "My School Years"
        }
       ]
      }
     ]
    },
    {
     "id": "past-my-influences",
     "title": "My Influences",
     "lists": [
      {
       "id": "what-shaped-me",
       "title": "What Shaped Me"
      }
     ]
    },
    {
     "id": "past-my-story",
     "title": "My Story",
     "lists": [
      {
       "id": "my-chapters",
       "title": "My Chapters"
      }
     ]
    }
   ]
  },
  {
   "id": "present",
   "title": "My Present",
   "color": "#3a9e78",
   "categories": [
    {
     "id": "present-my-current-life",
     "title": "My Current Life",
     "lists": [
      {
       "id": "my-now",
       "title": "My Now"
      }
     ]
    },
    {
     "id": "present-my-everyday-choices",
     "title": "My Everyday Choices",
     "lists": [
      {
       "id": "my-daily-choices",
       "title": "My Daily Choices"
      }
     ]
    }
   ]
  },
  {
   "id": "possibilities",
   "title": "My Possibilities",
   "color": "#7a6fd0",
   "categories": [
    {
     "id": "possibilities-my-future",
     "title": "My Future",
     "lists": [
      {
       "id": "my-hopes",
       "title": "My Hopes"
      }
     ]
    },
    {
     "id": "possibilities-my-paths",
     "title": "My Paths",
     "lists": [
      {
       "id": "paths-i-could-take",
       "title": "Paths I Could Take"
      }
     ]
    },
    {
     "id": "possibilities-my-opportunities",
     "title": "My Opportunities",
     "lists": [
      {
       "id": "open-doors",
       "title": "Open Doors"
      }
     ]
    }
   ]
  },
  {
   "id": "authentic",
   "title": "My Authentic Life",
   "color": "#5d6a8a",
   "categories": [
    {
     "id": "authentic-my-decisions",
     "title": "My Decisions",
     "lists": [
      {
       "id": "choices-that-are-mine",
       "title": "Choices That Are Mine"
      }
     ]
    },
    {
     "id": "authentic-my-reflections",
     "title": "My Reflections",
     "lists": [
      {
       "id": "my-reflections",
       "title": "My Reflections"
      }
     ]
    },
    {
     "id": "authentic-my-priorities",
     "title": "My Priorities",
     "lists": [
      {
       "id": "what-comes-first",
       "title": "What Comes First"
      }
     ]
    }
   ]
  }
 ]
}